,issuekey,storypoints,context
1444,121365818,2,add controversial toggle boost position please read the definition ready dor find before open new issue sure search keyword issue filter label verify feature submit duplicate goal give user control ad convert user controversial audience ease pressure supply as register minds user i want aware controversial boost setting able change newsfeed i well control content i what need add control boost position rotator feed allow user toggle controversial preference boost qa consideration give issue demo test prior deploy ux design sufficient wireframe present understand development team full mockup require usable component encourage see persona who user impact optional experiment experiment require clear expect if experiment require hypothesis outline acceptance criteria everyone able understand expect deliver x tooltip display new setting cog boost rotator x setting cog link boost setting x test definition ready checklist definition of done dod acceptance criterion weighted qa ux design personas experiment
1445,121365507,3,clarify expectation twitter connection supermind please read the definition ready dor find before open new issue sure search keyword issue filter label verify feature submit duplicate goal as user respond supermind i want know minds request permission post behalf know post connect twitter oauth as user respond supermind i want visualize post twitter agree what need spec improvement ux flow relate post supermind twitter address user story flow connect twitter oauth respond supermind offer require twitter repost happen user flow reposte supermind respond twitter can happen multiple time user qa consideration give issue demo test prior deploy ux design sufficient wireframe present understand development team full mockup require usable component encourage see persona who user impact optional creator experiment experiment require clear expect if experiment require hypothesis outline n a acceptance criteria everyone able understand expect deliver implement design change update test definition ready checklist definition of done dod acceptance criterion weighted qa ux design personas experiment
1446,121353408,3,enable admin specify boost rejection reason please read the definition ready dor find before open new issue sure search keyword issue filter label verify feature submit duplicate goal as admin i want specify reason reject boost customer clear transparent message as boost customer i want clear transparent messaging i understand boost reject what need update messaging boost console customer update messaging email customer qa consideration give issue demo test prior deploy ux design see personas admins boost customer acceptance criteria everyone able understand expect deliver store boost rejection reason vitess update rejection notification email display rejection reason display rejection reason user boost console three reason store enum wrong audience against mind boost policy against stripe term service onchain payment fail definition ready checklist definition of done dod acceptance criterion weighted qa ux design personas experiment
1447,121297565,2,deflake test please read before open new issue sure search keyword issue filter t bug label verify issue submit duplicate summary work testbe flake step reproduce run ci platform information ci what current bug behavior flakey test what expect correct behavior common know issue fix relevant log screenshot paste relevant log use code block format console output log code hard read possible fix if link line code responsible problem
1448,121240727,1,boost remove use token modal please read the definition ready dor find before open new issue sure search keyword issue filter label verify feature submit duplicate goal reduce ux friction what need remove sure want use token modal switch budget panel boost modal qa modal appear switching pool function correctly pass ux design n a persona boost user experiment cover large boost flag need touch individual change acceptance criteria keep component bring remove execution popup confirmation modal switch token budget selection panel ensure unit pass this will likely break definition ready checklist definition of done dod acceptance criterion weighted qa ux design personas experiment
1450,120441013,3,paywall unlock button open wire modal please read the definition ready dor find before open new issue sure search keyword issue filter label verify feature submit duplicate goal clearly outline goal issue user able join membership join membership button redirect sep open wire modal update contain image rich embeds status post i click video open wire modal further investigation require what need clearly detail need achieve goal set paywall button open wire modal qa consideration give issue demo test prior deploy post custom membership paywall upgrade paywalled activity post ux design sufficient wireframe present understand development team full mockup require usable component encourage n persona who user impact optional user want access paywalle content experiment experiment require clear expect if experiment require hypothesis outline acceptance criteria everyone able understand expect deliver paywall button open wire modal definition ready checklist definition of done dod acceptance criterion weighted qa ux design personas experiment
1451,120405644,2,failure supermind please read before open new issue sure search keyword issue filter t bug label verify issue submit duplicate summary fix issue step reproduce run ci pipeline platform information ci what current bug behavior fail what expect correct behavior pass relevant log screenshot paste relevant log use code block format console output log code hard read possible fix if link line code responsible problem
1452,120112044,1,replace m page sep please read the definition ready dor find before open new issue sure search keyword issue filter label verify feature submit duplicate goal clearly outline goal issue click trend post discovery feed open item sep instead arbitrary interim trend specific page redirect instead plus previously component existence justify button implement button seps additional component necessary this match user expectation happen activity click feed remove redundant trend specific activity presentation page maintain single entity view place what need clearly detail need achieve goal set click trend item open sep trend page qa consideration give issue demo test prior deploy clicking trend discovery feed lead seps ux design sufficient wireframe present understand development team full mockup require usable component encourage n persona who user impact optional discovery feed consumer devs experiment experiment require clear expect if experiment require hypothesis outline n acceptance criteria everyone able understand expect deliver x click trend item open sep trend page x m component delete definition ready checklist definition of done dod acceptance criterion weighted qa ux design personas experiment
1455,119882110,5,uniqueness verification flow web please read the definition ready dor find before open new issue sure search keyword issue filter label verify feature submit duplicate goal clearly outline goal issue as web user i forward mobile verification flow i join reward program what need clearly detail need achieve goal set implement design qa consideration give issue demo test prior deploy ux design sufficient wireframe present understand development team full mockup require usable component encourage persona who user impact optional token user experiment experiment require clear expect if experiment require hypothesis outline yes agree acceptance criteria everyone able understand expect deliver implement design provide deepliking appstore flow work qr code link open app mobile web page app store link apk integration test definition ready checklist definition of done dod acceptance criterion weighted qa ux design personas experiment
1456,119878667,3,as user i able new dynamic boost rotator feed slot sidebar slot please read the definition ready dor find before open new issue sure search keyword issue filter label verify feature submit duplicate goal clearly outline goal issue as user i able new dynamic boost rotator feed slot what need clearly detail need achieve goal set when feature flag point new boost endpoint instead one qa consideration give issue demo test prior deploy ux design sufficient wireframe present understand development team full mockup require usable component encourage persona who user impact optional experiment experiment require clear expect if experiment require hypothesis outline use epic flag acceptance criteria everyone able understand expect deliver implement rule activity boost newsfeed slot channel boost sidebar slot other entity type support implement rule safe boost deliver user opt open boost open boost never deliver user opt safe boost definition ready checklist definition of done dod acceptance criterion weighted qa ux design personas experiment
1457,119764354,3,when i block post post immediately disappear please read the definition ready dor find before open new issue sure search keyword issue filter label verify feature submit duplicate goal clearly outline goal issue post immediately hide view user block dropdown what need clearly detail need achieve goal set just require refresh should disappear live qa consideration give issue demo test prior deploy ux design sufficient wireframe present understand development team full mockup require usable component encourage persona who user impact optional experiment experiment require clear expect if experiment require hypothesis outline acceptance criteria everyone able understand expect deliver from feed discovery block remove feed integration test definition ready checklist definition of done dod acceptance criterion weighted qa ux design personas experiment
1458,119616726,3,update slider behaviour cash boost modal please read the definition ready dor find before open new issue sure search keyword issue filter label verify feature submit duplicate goal slider behavior currently bit tricky use adjust need improve feel allow selection differ amount what need confirm behavior remove block question what user want select value outside range go possible do not allow segment provide backend do want slider snap different value yes snap value backend modify slider behavior match qa test slider ux design see persona boost user experiment no direct experiment indirectly cash boost flag acceptance criteria assess native html input meet criterion use like match slider cash token behavior specify what need header make sure thumb slider value drag update unit test definition ready checklist x definition of done dod x acceptance criterion x weighted x qa x ux design x personas x experiment
1459,119614835,2,add confirmation modal cash boost please read the definition ready dor find before open new issue sure search keyword issue filter label verify feature submit duplicate goal clearly indicate user boost cash alleviate confusion accidental spending cash tab new boost modal design what need add confirmation modal like submit cash boost qa text confirmation modal appear make cash boost ux design agreeing use exist component need design spec persona boost user experiment indirectly cover cash boost experiment individual flag need acceptance criteria add confirmation modal appear submit cash boost not token confirm text modal minor adjustment need check test need quickly update well create new fragment confirmation modal boostmodal fragment hit post cash fix broken unit test definition ready checklist x definition of done dod x acceptance criterion x weighted x qa x ux design x personas x experiment
1460,119592224,3,cleanup guest mode reimplement please read the definition ready dor find before open new issue sure search keyword issue filter label verify feature submit duplicate goal clearly outline goal issue improve traffic homepage low bounce rate better understand log user what need clearly detail need achieve goal set x pick discovery x track log traffic time retroactive action need hide x discovery your tag tab x discovery content setting menu contain social compass survey x referral link menu x upgrade banner feed x extraneous border trend feed x extraneous border discovery trend page prompt auth modal x supermind button prompt auth modal change other x leave deployment note pick a b test enable discovery homepage x upvote downvote button prevent wiggle animation x make sep metric unclickable guest x auth modal checkboxe need vertical spacing x remove padding discovery guest mode replicable change qa consideration give issue demo test prior deploy ux design sufficient wireframe present understand development team full mockup require usable component encourage persona who user impact optional experiment experiment require clear expect if experiment require hypothesis outline acceptance criteria everyone able understand expect deliver everything list address run experiment production definition ready checklist definition of done dod acceptance criterion weighted qa ux design personas experiment
1461,122265621,5,clarify expectation twitter connection supermind goal as user respond supermind i want know minds request permission post behalf know post connect twitter oauth as user respond supermind i want visualize post twitter agree what need spec improvement ux flow relate post supermind twitter address user story flow connect twitter oauth respond supermind offer require twitter repost happen user flow reposte supermind respond twitter can happen multiple time user personas creator ux design flow figma flow web mobile placeholder image acceptance criteria x web ux visual user story describe x mobile ux visual user story x developer feedback feasibility user feedback usability definition ready checklist definition of done dod acceptance criterion weighted qa ux design personas experiment
1462,119357303,1,channel recs description cut mobile web please read the definition ready dor find before open new issue sure search keyword issue filter label verify feature submit duplicate goal clearly outline goal issue the word description completely visible cut subscribe button what need clearly detail need achieve goal set make description text end subscribe button start qa consideration give issue demo test prior deploy channel rec visual testing ux design sufficient wireframe present understand development team full mockup require usable component encourage n persona who user impact optional feed user experiment experiment require clear expect if experiment require hypothesis outline n acceptance criteria everyone able understand expect deliver description visible channel recs mobile web definition ready checklist definition of done dod acceptance criterion weighted qa ux design personas experiment chann
1463,119098882,8,build new boost creation flow please read the definition ready dor find before open new issue sure search keyword issue filter label verify feature submit duplicate goal clearly outline goal issue allow user create boost run multiple day what need clearly detail need achieve goal set build component flow ux mockup flow qa consideration give issue demo test prior deploy see flow ux design sufficient wireframe present understand development team full mockup require usable component encourage mockup provide persona who user impact optional booster experiment experiment require clear expect if experiment require hypothesis outline yes acceptance criteria everyone able understand expect deliver implementation ui component flow ux mockup experiment flag setup test definition ready checklist definition of done dod acceptance criterion weighted qa ux design personas experiment
1464,118666073,2,unable post non supermind content please read before open new issue sure search keyword issue filter t bug label verify issue submit duplicate summary can post non supermind step reproduce try post non supermind platform information web what current bug behavior can post non supermind what expect correct behavior posting block relevant log screenshot paste relevant log use code block format console output log code hard read possible fix
1465,119976627,2,supermind button post pre populate channel summary when click supermind button post supermind dialog appear pre populate target field channel step reproduce navigate activity post click supermind button activity post large button activity bar button platform information web what current bug behavior the supermind screen pre populate channel target field what expect correct behavior the target field leave blank click supermind button post relevant log screenshot possible fix if link line code responsible problem
1466,118577683,1,create secondary test user create please read the definition ready dor find before open new issue sure search keyword issue filter label verify feature submit duplicate goal clearly outline goal issue create secondary generic test user password share bitwarden to situation require multiple generic user what need clearly detail need achieve goal set register new account username share password bitwarden add reference test example file qa consideration give issue demo test prior deploy none ux design sufficient wireframe present understand development team full mockup require usable component encourage n persona who user impact optional devs experiment experiment require clear expect if experiment require hypothesis outline n acceptance criteria everyone able understand expect deliver new test user create password share bitwarden reference example definition ready checklist definition of done dod acceptance criterion weighted qa ux design personas experiment
1467,118443409,2,migrate data cy tag data ref tag please read the definition ready dor find before open new issue sure search keyword issue filter label verify feature submit duplicate goal unify datum tag naming standard datum pipeline what need migrate exist data cy tag data ref syntax ensure set rule place naming convention some tag will need rename ensure relevant datum qa test green light ux design n a personas developers datum experiment n a acceptance criteria decide syntactic structure data tag define doc maybe reference data doc page simple example data ref block element example implement data ref composer modal submit button anything improve naming consistancy appreciate data regex submit button ideal this neccesarily easy cleanly clear definition help bounce proposal chisel rule stone get rid data mind section tag useless update exist codecept playwright test update exist tag use abide convention definition ready checklist x definition of done dod x acceptance criterion weighted x qa x ux design x personas x experiment
1468,118156053,2,remove cluster recs channelrec experiment flag please read the definition ready dor find before open new issue sure search keyword issue filter label verify feature submit duplicate what need clearly detail need achieve goal set remove cluster recs experiment flag cleanup old code qa consideration give issue demo test prior deploy tbd ux design sufficient wireframe present understand development team full mockup require usable component encourage n a persona who user impact optional nerd experiment experiment require clear expect if experiment require hypothesis outline n a acceptance criteria everyone able understand expect deliver remove cluster recs experiment flag remove channelrec remove vitess cluster recs definition ready checklist definition of done dod acceptance criterion weighted qa ux design personas experiment
1469,118155559,5,remove activity experiment flag please read the definition ready dor find before open new issue sure search keyword issue filter label verify feature submit duplicate what need clearly detail need achieve goal set remove activity flag remove legacy activity component qa consideration give issue demo test prior deploy tbd ux design sufficient wireframe present understand development team full mockup require usable component encourage n a persona who user impact optional devs nerd experiment experiment require clear expect if experiment require hypothesis outline acceptance criteria everyone able understand expect deliver remove activity definition ready checklist definition of done dod acceptance criterion weighted qa ux design personas experiment
1470,118146563,3,update boost modal support pay cash please read the definition ready dor find before open new issue sure search keyword issue filter label verify feature submit duplicate goal clearly outline goal issue add ability pay boost cash increase revenue monetise boost open boost functionality non token holder what need clearly detail need achieve goal set outcome qa consideration give issue demo test prior deploy test end end flow ux design sufficient wireframe present understand development team full mockup require usable component encourage to provide persona who user impact optional booster experiment experiment require clear expect if experiment require hypothesis outline yes acceptance criteria everyone able understand expect deliver frontend change test definition ready checklist definition of done dod acceptance criterion weighted qa ux design personas experiment
1471,117967502,3,single image quote post open image modal please read before open new issue sure search keyword issue filter t bug label verify issue submit duplicate summary quote post single image allow user view image modal similar issue happen multiple image step reproduce view quote post single image click image platform information brave what current bug behavior nothing happen what expect correct behavior the clicked image open modal view similar happen multi image quote post single image normal post add test verify modal open single multi regular quote post relevant log screenshot possible fix if link line code responsible problem
1472,117959195,3,complete metascraper migration please read the definition ready dor find before open new issue sure search keyword issue filter label verify feature submit duplicate goal complete metascraper migration what need migrate twitter sync migrate yt sync preview qa test twitter sync yt sync preview work ux design n a personas yt twitter sync user experiment metascraper feat flag feat flag acceptance criteria migrate yt preview migrate twitter sync preview new feature flag definition ready checklist x definition of done dod x acceptance criterion weighted x qa x ux design x personas x experiment
1473,117957102,1,adjust growthbook hasvariation function variation input default true please read the definition ready dor find before open new issue sure search keyword issue filter label verify feature submit duplicate goal clearly outline goal issue the experiment hasvariation function input one experiment optional value currently optional value default set string growthbook update change way work set boolean true default instead what need clearly detail need achieve goal set change default value true wherever variation input add qa consideration give issue demo test prior deploy active experiment ux design sufficient wireframe present understand development team full mockup require usable component encourage n persona who user impact optional n experiment experiment require clear expect if experiment require hypothesis outline n acceptance criteria everyone able understand expect deliver fx second input default true instead definition ready checklist definition of done dod acceptance criterion weighted qa ux design personas experiment
1474,117700385,3,change connect twitter modal spawn new tab please read the definition ready dor find before open new issue sure search keyword issue filter label verify feature submit duplicate goal keep original tab open load twitter auth modal what need qa test connect twitter modal ux design sufficient wireframe present understand development team full mockup require usable component encourage personas users connect twitter experiment n a acceptance criteria evaluate design want continue button success or design open composer confirm make spawn new tab from engine force close window fallback like may need polling logic check config update tell twitter success definition ready checklist x definition of done dod x acceptance criterion weighted x qa x ux design x personas x experiment co
1475,117638985,3,in feed composer height mess image present please read before open new issue sure search keyword issue filter t bug label verify issue submit duplicate summary in feed composer height mess image present step reproduce upload image composer close modal feed composer display post platform information web replicate firefox ubuntu what current bug behavior in feed composer look mess what expect correct behavior can deactivate prompt dirty state run modal close should look like modal composer should title should huge spacing relevant log screenshot possible fix if link line code responsible problem
1476,117827656,3,experiment alternative supermind button goal increase supermind purchase what need implement new design supermind button sep run experiment variation control current large supermind button variation new small supermind button general get reply creator like message refer mock a qa consideration give issue demo test prior deploy ux design figma persona who user impact optional experiment this roll experiment evenly distribute log user acceptance criteria everyone able understand expect deliver a b test a screenshot variant experiment add growthbook definition ready checklist x definition of done dod x acceptance criterion x weighted x qa x ux design x personas x experiment
