,issuekey,storypoints,context
1122,77361483,2,unable view image user channel summary user upload post consist image text when view dedicated page post appear normal view channel newsfeed image see step reproduce how reproduce issue important platform information browser device system stat screen size what current bug behavior only text visible view channel image appear text link follow what expect correct behavior what instead relevant log screenshot paste relevant log use code block format console output log code hard read possible fix if link line code responsible problem
1123,77313871,1,impossible remove thumbnail please read before open new issue sure search keyword issue filter t bug label verify issue submit duplicate summary there currently way remove image thumbnail post there option remove thumbnail iframely pull url step reproduce make post link try delete thumbnail image platform information windows chrome relevant log screenshot
1124,77231677,1,split cypress seperate repo please read before open new issue sure search keyword issue filter t bug label verify issue submit duplicate summary summarize bug encounter concisely step reproduce how reproduce issue important platform information browser device system stat screen size what current bug behavior what actually happen what expect correct behavior what instead relevant log screenshot paste relevant log use code block format console output log code hard read possible fix if link line code responsible problem
1125,77112546,1,go pro page banner please read before open new issue sure search keyword issue filter t bug label verify issue submit duplicate summary summarize bug encounter concisely step reproduce how reproduce issue important platform information browser device system stat screen size what current bug behavior what actually happen what expect correct behavior what instead relevant log screenshot paste relevant log use code block format console output log code hard read possible fix if link line code responsible problem
1126,76935264,2,wallet connect modal appear boost modal please read before open new issue sure search keyword issue filter t bug label verify issue submit duplicate summary summarize bug encounter concisely step reproduce go post try boost onchain platform information find ubuntu chromium look like platform agnostic behavior what current bug behavior modal stack order incorrect what expect correct behavior modal boost modal relevant log screenshot hard monitor you feintly boost modal hang click away wallet connect modal notice possible fix if link line code responsible problem
1127,76821272,1,boost feed user plus boost hide report
1128,76698285,1,unify channel card design subscriber list suggest channel carousel see work commence
1129,76692806,2,connected bank account require paywalle post please read before open new issue sure search keyword issue filter t bug label verify issue submit duplicate summary report you token paywalle post connect bank account step reproduce login account connected bank try new paywall membership tab channel platform information replicated firefox ubuntu suspect platform agnostic what current bug behavior user require register bank able create non usd paywall what expect correct behavior this requirement visible user opt recieve usd relevant log screenshot possible fix if link line code responsible problem
1130,76551450,1,permaweb backlink issue please read before open new issue sure search keyword issue filter t bug label verify issue submit duplicate summary backlink metatag link step reproduce see link page platform information replicated firefox ubuntu what current bug behavior link what expect correct behavior it link post relevant log screenshot possible fix if link line code responsible problem
1131,76533997,1,sidebar rec issue x do open modal x remind post x short text post maintain huge text sidebar barely read x no padding date view count
1132,76439413,1,space issue suggest post
1133,76435455,1,long bio string cause overflow listing page
1134,76435426,1,bad space post prompt
1135,76277783,1,channel buttons out of alignment please read before open new issue sure search keyword issue filter t bug label verify issue submit duplicate summary edit channel subscribe button channel feed alignment compare correspond button quantum gecko derivative rendering engine base browser step reproduce view channel base button mozilla firefox browser use quantum gecko base derivative web rendering engine platform information quantum gecko base browser ie mozilla firefox pale moon test version mozilla firefox pale moon chromium midori issue noticeable firefox new moon unofficial build pale moon relevant log screenshot quantum quantum quantum quantum
1136,76277154,2,membership subscriber unlock exclusive content user join bronze tier notif send billing update transaction occur when user unlock exclusive content content unlock instead user route mind pay join membership page dialogue you member as result member able open exclusive content the content display subscribed member unmasked bronze badge upper right corner windows chrome ff
1137,76261144,1,ui issue ubuntu chromium the sidebar skew ubuntu version have check machine
1138,76149563,1,create usable popover component mockup note use variant padding margin
1140,76080555,3,error message access group ban please read before open new issue sure search keyword issue filter t bug label verify issue submit duplicate summary currently user block group appear show indication case step reproduce account create test group account b join account ban user b account b try rejoin what expect correct behavior via ben presuming i server send response identify user block i go throw toast error warning say line you ban group
1141,76042381,2,implement revise comment web a redesign improved structure web implement the include design cover dark mode a single light mode screen find note mobile responsive layout comment show reply reply input the term comment apply level comment item anything deeply simply refer reply comment reply input there new filter option relate comment top late note filter option apply level comment reply top this default selection comment vote comment combine display late comment arrange old new explicit comment embed url comment embed video image comment long comment reply collapsed expand contexts modal blog post page cc
1142,75916590,2,link refund boost console transaction refund the problem issue boost refund difficult admin user alike track some user erroneously believe refund user actual refund credit when multiple boost difficult gain proof claim refund proposal if boost refunded state store able generate indicator refund pay ideally click text link ledger auto scroll correct place minimum date time refund show text
1143,75441531,1,can edit video banner cover image upload please read before open new issue sure search keyword issue filter t bug label verify issue submit duplicate summary can edit video banner cover image upload step reproduce edit video try set cover photo platform information browser device system stat screen size what current bug behavior either photo automatically update take time image size big what expect correct behavior we swap image post posting relevant log screenshot paste relevant log use code block format console output log code hard read possible fix if link line code responsible problem
1144,75065628,1,youtube migration pages footer link in reference i suggest remove youtube migration link href associate page footer non canary user attach add statement display possibly non canary member migration page reference page link official migrate youtube library minds today blog article reference migrate your youtube library to minds today youtube migration link within the footer for associated page p p
1145,74901433,1,blog visibility work correctly please read before open new issue sure search keyword issue filter t bug label verify issue submit duplicate summary i set loggedin visibility edit it disappear homepage listing i reset visibility public publish go have use browser history find i remind show homepage remain hidden i try replicate i get different erronous behavior matter set show feed step reproduce set new blog logged publish check feed log check channel try change visibility public try change visibility unlisted platform information suspected cross platform replicate firefox what current bug behavior visibility function correctly blog what expect correct behavior it work logically relevant log screenshot paste relevant log use code block format console output log code hard read possible fix if link line code responsible problem
1146,74855471,1,add latest tab please read before open new issue sure search keyword issue filter t bug label verify issue submit duplicate summary summarize bug encounter concisely step reproduce how reproduce issue important platform information browser device system stat screen size what current bug behavior what actually happen what expect correct behavior what instead relevant log screenshot paste relevant log use code block format console output log code hard read possible fix if link line code responsible problem
1147,74356499,1,remove settings button user pro channel summary redundant button brings user setting purpose
1148,74266782,8,prompt user late post newsfeed when user scroll feed new content available however currently app poll notifie user new content view please design acceptance criterion poll content second late feed display late content hover tag the api endpoint use count query efficiency do poll browser inactive introduce experiment d polling use search query time badge ticket read see x new post in context newsfeed ensure scroll boost rotator
1149,74119781,1,prevent group post inside plus please read before open new issue sure search keyword issue filter t bug label verify issue submit duplicate summary post locked post group pool feed step reproduce post post group platform information any what current bug behavior do plus group post plus feed what expect correct behavior post group plus feed relevant log screenshot na possible fix if link line code responsible problem
1150,73625958,1,m topbarwrapper m captura png
1152,73170202,1,frontend module new messenger lazy load module use feature flag spec test
1153,73168369,1,user auto suggest list appear stuff captura png
1154,73107116,1,minor refactor mini composer newsfeed the mini composer newsfeed modify match design show dark mode light mode
1155,87823595,2,add button link open edit channel inside setting add profile settings display name settings should spawn modal edit channel button channel
1156,72407875,1,z index bug paywall badge hide underneath post menu dropdown
1157,72033434,1,composer nsfw guideline link break the guideline link lose post content click
1159,71438109,1,very long word discovery feed break discovery layout summary the discovery layout break long word exceed allowable length step reproduce any post discovery feed long url break discovery layout platform information macos chrome wide what current bug behavior correspond image get push what expect correct behavior text wrap event relevant log screenshot possible fix word break break word
1160,71435042,3,grid layout channel feed the presentation feed extend allow list exist introduction new grid feature design find large medium note it end user preference wish use list grid view channel specify default layout list grid icon add channel page these present user feed when access membership option hide grid view available small screen activity item display alternate simplify mean author info social interaction present in future iteration aim introduce social interaction degree for iteration click item simply bring user dedicated post page in future release post display modal reminds exclude grid layout ideally date update relative time display datetime fall hrs hour ago yesterday display month day sept
1161,71319871,1,blog metadata author description show tag please read before open new issue sure search keyword issue filter t bug label verify issue submit duplicate summary summarize bug encounter concisely step reproduce how reproduce issue important platform information browser device system stat screen size what current bug behavior what actually happen what expect correct behavior what instead relevant log screenshot paste relevant log use code block format console output log code hard read possible fix if link line code responsible problem
1162,71260912,1,table alignment view edit discrepancy please read before open new issue sure search keyword issue filter t bug label verify issue submit duplicate
1163,71228479,2,simplify monetize process composer both web mobile monetize screen list custom membership create remove custom tab option completely if link upgrade call upgrade modal if membership link create membership take stripe onboarding complete take create membership tier screen onboarde stripe if user remove requirement check term box choose exclusivity period mocks web mocks mobile new quick access monetize include design
1164,71225616,1,design experience press post button include boost recommendation see design click user create post after create post user see post create news feed after delay popover appear where un interacted fade behavioral specification as user i want prompt boost post i submit give i post time i tooltip prompt boost post tooltip position boost button blue stay second dismissable give i see tooltip i boost button post shimmer i submit post shimmer second flash
1165,71194154,2,maintainence please read before open new issue sure search keyword issue filter t bug label verify issue submit duplicate summary summarize bug encounter concisely step reproduce how reproduce issue important platform information browser device system stat screen size what current bug behavior what actually happen what expect correct behavior what instead relevant log screenshot paste relevant log use code block format console output log code hard read possible fix if link line code responsible problem
1166,71135379,1,make monetization default option composer make default feature flag
1167,71114270,1,add ipad image apple store
1168,71062587,1,composer title expand line please read before open new issue sure search keyword issue filter t bug label verify issue submit duplicate summary summarize bug encounter concisely step reproduce how reproduce issue important platform information browser device system stat screen size what current bug behavior what actually happen what expect correct behavior what instead relevant log screenshot paste relevant log use code block format console output log code hard read possible fix if link line code responsible problem
1169,71062017,1,make exclusive content thumbnail clickable unlock thought
1170,70750974,1,composer cutoff mobile web
1172,69855411,1,inclusion of status compose field within channel section as suggest inclusion status compose field channel section help improve accessibility channel comparable functionality provide group
1173,69818997,1,pro notification info hover cutoff please read before open new issue sure search keyword issue filter t bug label verify issue submit duplicate summary when hover pro balance question mark information block cut header bar step reproduce hover pro balance platform information chrome macbook pro what current bug behavior what expect correct behavior z index change notification box sized change read info relevant log screenshot paste relevant log use code block format console output log code hard read possible fix change at end month pro earning pende balance reach threshold when happen pro earning reset zero if reach threshold earning rollover month pro earning pende transfer monthly reach otherwise pro earnings rollover month
1174,69810063,1,handle giant logo image pro topbar pro user upload pro logo pro asset setting fall channel avatar on site avatar display properly background image contain
1175,69651122,1,permaweb test please read before open new issue sure search keyword issue filter t bug label verify issue submit duplicate summary summarize bug encounter concisely step reproduce how reproduce issue important platform information browser device system stat screen size what current bug behavior what actually happen what expect correct behavior what instead relevant log screenshot paste relevant log use code block format console output log code hard read possible fix if link line code responsible problem
1176,69526900,2,reminding break newsfeed page please read before open new issue sure search keyword issue filter t bug label verify issue submit duplicate summary big thank chesschats point when remind newsfeed page create remind create copy original entity guid this cause strange behaviour area comment notification delete break thing if delete secondary post leave original post remove actual medium if text remind box actually save description new post it get post api newsfeed remind x endpoint step reproduce make post image click timestamp newsfeed page remind check channel post clone remind mouse timestamp guid url identical platform information initially report ios safari tablet replicated firefox ubuntu what current bug behavior post clone remind what expect correct behavior reminding work like site relevant log screenshot v remind clone post v v delete v possible fix if link line code responsible problem
1177,69478698,1,add setting link pro channel member cancel for pro channel member display setting link navigation lead recur payment setting page
1178,69471649,2,require login page currently set noindex in order continue pressure reduce spam ticket propose introduce login gatekeeper content channel low interaction all content accessible network log verify channel exempt restriction post owner aware content accessible log user content currently place noindex channel few subscriber blog few vote newsfeed medium few vote message please login create channel view content login form inline require refreshe redirect complication post party network facebook twitter issue cache additional benefit more user create account task introduce gatekeeper strategic page newsfeed single page blog channel feed for og title tag provide metadata cache concern
1179,69383606,1,the new membership tier warning link open new tab lose tier input if create new membership tier set bank account click link lose write membership it open new tab set token address warning or form disable set cash account
1180,69383541,1,birthday input yell date birth placeholder cap so angry also month fit
1181,69383467,1,wallet scroll setting work in wallet onboarding click add chain address screen scroll chain address input visible currently click link feel like break
1182,69446793,1,sign pro site subscribe go join splash close payment flow subscribe homepage button subscribe
1183,69371535,1,open sendwyre new tab please read before open new issue sure search keyword issue filter t bug label verify issue submit duplicate summary summarize bug encounter concisely step reproduce how reproduce issue important platform information browser device system stat screen size what current bug behavior what actually happen what expect correct behavior what instead relevant log screenshot paste relevant log use code block format console output log code hard read possible fix if link line code responsible problem
1184,69300416,1,when group delete direct old page
1185,69240796,1,localization page link please read before open new issue sure search keyword issue filter t bug label verify issue submit duplicate summary localization page contain link localization page accessible link follow page policy migration term privacy contact dmca billofright what expect correct behavior poedit link provide localization page replace link update crowdin url relevant log screenshot localization page br poedit facility br crowdin facility br
1186,69183326,1,update ban email make content policy hyperlink add specific reason ban update text read unfortunately channel ban violate content policy the specific reason insert reason remove section download mobile app ban
1187,69175819,1,default wallet cash remember tab simple visit encourage onboarde stripe
1188,68960854,1,crop reposition avatar channel edit screen when set profile onboarding flow crop reposition avatar image upload but later channel page click edit channel able upload image crop reposition
1189,68953359,2,implement new topbar pro site mockup
1190,68953342,2,implement pro splash configuration pro set general enable frontend splash page mockup
1191,68862708,1,implement cta membership tier screen show action mockup
1192,68842046,1,press unlock post trigger upgrade modal please read before open new issue sure search keyword issue filter t bug label verify issue submit duplicate summary currently press unlock post open regular pay modal it open modal also image modal render screenshot attach step reproduce go enable test channel click unlock platform information chrome macbook what current bug behavior see summary what expect correct behavior trigger upgrade modal relevant log screenshot possible fix if link line code responsible problem
1193,68256379,1,disable comment vote content make acl interact hook aware paywalle status mr
1194,59457620,1,pro homepage fallover feed scroll
1195,59201584,1,when delete blog bring you simply stay channel oldpage png
1197,57970995,1,add favicon pro asset page maybe solution easy bulb
1198,55649471,1,pro site flash mind sidebar navigation loading please read before open new issue sure search keyword issue filter t bug label verify issue submit duplicate summary pro site flash mind sidebar navigation load step reproduce platform information mobile what current bug behavior sidebar navigation open what expect correct behavior should display relevant log screenshot possible fix if link line code responsible problem
1199,55390031,3,implement new pro design task domain view view refactor channel support new pro interface mockup
1200,115055487,1,persistent feed view comment activity post please read the definition ready dor find before open new issue sure search keyword issue filter label verify feature submit duplicate goal clearly outline goal issue in persistent feed remove comment outlet feed remove view comment link we want add what need clearly detail need achieve goal set re add view comment link activity post feed qa consideration give issue demo test prior deploy make sure view comment visible post comment ux design sufficient wireframe present understand development team full mockup require usable component encourage n a persona who user impact optional all experiment experiment require clear expect if experiment require hypothesis outline same exp persistent feed acceptance criteria everyone able understand expect deliver view comment visible definition ready checklist definition of done dod acceptance criterion weighted qa ux design personas experiment
1202,114988649,3,clearly communicate refund policy payment screen please read the definition ready dor find before open new issue sure search keyword issue filter label verify feature submit duplicate goal clearly outline goal issue clearly communicate refund policy payment screen risk lose dispute chargeback user understand refund what need clearly detail need achieve goal set on screen user able submit payment add check box agree refund qa consideration give issue demo test prior deploy payment send box check user understand refund policy ux design sufficient wireframe present understand development team full mockup require usable component encourage no design necessary developer handle superminds i understand transaction non refundable recipient approve offer memberships i understand transaction non refundable tips i understand transaction non refundable i understand transaction non refundable minds pro i understand transaction non refundable persona who user impact optional customer well inform refund policy minds admin well able respond chargeback dispute experiment experiment require clear expect if experiment require hypothesis outline none acceptance criteria everyone able understand expect deliver supermind send box check tip send box check purchase box check mind pro purchase box check memberships purchase box check definition ready checklist definition of done dod acceptance criterion weighted qa ux design personas experiment
1203,115342816,3,confirm price authorization press post create supermind offer goal clearly communicate use create supermind offer offer commit authorize charge order avoid mistake what need on composer press post ensure confirm modal outlining price authorization card user fill checkbox confirm agree term qa consideration give issue demo test prior deploy ux design figma mock persona who user impact optional experiment experiment require clear expect if experiment require hypothesis outline acceptance criteria on composer press post ensure confirm modal outlining price authorization card user accept term confirm button active playright test definition ready checklist definition of done dod acceptance criterion weighted qa ux design personas experiment
