,issuekey,storypoints,context
0,55375645,1,pro asset save please read before open new issue sure search keyword issue filter t bug label verify issue submit duplicate summary pro asset step reproduce not provide platform information not provide what current bug behavior pro asset save what expect correct behavior pro asset save relevant log screenshot not provide possible fix shrug
1,55372908,2,only timcast irl content log task need build
2,54304496,1,pro cancellation redirect mind please read before open new issue sure search keyword issue filter t bug label verify issue submit duplicate summary pro cancellation redirect mind step reproduce cancel pro have different username platform information should cross platform what current bug behavior the wrong page link member leave uncertain cancellation work bug what expect correct behavior it redirect channel relevant log screenshot possible fix if link line code responsible problem
3,54192211,1,user menu close click sidebar nav item menu currently close sidebar nav click
4,54048570,1,when feature flag redirect setting support tier channel shop redirect channel shop
5,53978348,2,an invalid input supply paywall entity please read before open new issue sure search keyword issue filter t bug label verify issue submit duplicate summary user edit save post step reproduce how reproduce issue important platform information browser device system stat screen size what current bug behavior user edit save post what expect correct behavior user able edit save post relevant log screenshot possible fix if link line code responsible problem
6,53945649,1,cancel button editor issue summary user report bug cancel button edit image post image nearly delete user choose cancel deletion image delete step reproduce unable reproduce platform information linux chrome clone relevant log screenshot
7,53793591,1,do allow external link submit plus add following text plus monetize section add error prompt try add link check box click post external link submit plus
9,51647938,1,do this video transcode video play this video transcode you receive notification complete the video actually post sub minimum transcode right also version stillll png
10,50160664,1,language footer skew small screen bounty issue
11,50145109,1,stackable modal close reroute the stackable modal close navigate away click wallet upgrade plus modal
12,49993877,1,make badge blue summary user report see green badge step reproduce unable reproduce platform information mobile app
13,49976441,2,add icon hashtag add tag design newsfeed sidebar tag discovery sidebar tag search result hashtag cc
14,57545087,2,create plus view firehose x backend filter plus opt exist x easy way admin toggle plus content
15,49913490,1,implement new captcha modal please read before open new issue sure search keyword issue filter t bug label verify issue submit duplicate summary summarize bug encounter concisely step reproduce how reproduce issue important platform information browser device system stat screen size what current bug behavior what actually happen what expect correct behavior what instead relevant log screenshot paste relevant log use code block format console output log code hard read possible fix if link line code responsible problem
16,49785503,1,post edit skewed show publish edit require refresh
17,46596210,1,notification close popup cicke notification please read before open new issue sure search keyword issue filter t bug label verify issue submit duplicate summary notifications close select notification intend behavior mobile device i think decrease usability notification desktop if possible apply mobile notification step reproduce open notification click menu close platform information cross platform web what current bug behavior the window close select notification open scroll what expect correct behavior you window click relevant log screenshot paste relevant log use code block format console output log code hard read possible fix if link line code responsible problem
18,45168017,2,homepage topbar flicker cutoff firefox
19,42972650,2,fix exist frontend use new support tiers please read before open new issue sure search keyword issue filter t bug label verify issue submit duplicate summary summarize bug encounter concisely step reproduce how reproduce issue important platform information browser device system stat screen size what current bug behavior what actually happen what expect correct behavior what instead relevant log screenshot paste relevant log use code block format console output log code hard read possible fix if link line code responsible problem
21,42958568,1,brief shop component content base feature flag hide see link if support tier enable read api supporttier else read polyfill api wire reward
22,41970118,3,make wire modal stackable the design monetize popup composer button user upgrade pro in order upgrade pro composer know need stack wire composer modal post composer but stackable modal component complex overlay modal overlay modal service something adjust order incorporate functionality wire modal necessitate ideally solution dry stackable modal functionality overlay modal
24,43052637,3,implement quick fix new blog editor quick stylization make hyperclean fullscreen swap ckeditor line ben attempt composer version complicated clean post option button array design blog view basically stay minus clean engagement button
25,68881284,2,a user sub message admin
26,35518561,1,implement notification limit limit number notification send on notification dispatcher stage check previous x message entity hydration need spec test
27,35489804,2,create monetization structure composer x tabs x language plus pro tab x upgrade pro button logic mockup
28,35486800,2,unable enable please read before open new issue sure search keyword issue filter t bug label verify issue submit duplicate summary i enable multi factor authentication production locally a issue vary severity a previously valid number uk long valid on return country selector reset right border box shadow miss input field country code character number field return country code end truncate step reproduce log go settings security two factor authentication try enter uk number platform information cross platform web what current bug behavior a member setup mfa what expect correct behavior a member able set mfa relevant log screenshot possible fix if link line code responsible problem
29,35444514,2,audit string confirm validity audit confirm validity rebuild npm run be use deprecate do id be duplicate label placeholder label prefix id
30,35441691,1,reintroduce admin set pro option please read before open new issue sure search keyword issue filter t bug label verify issue submit duplicate summary summarize bug encounter concisely step reproduce how reproduce issue important platform information browser device system stat screen size what current bug behavior what actually happen what expect correct behavior what instead relevant log screenshot paste relevant log use code block format console output log code hard read possible fix if link line code responsible problem
31,35440988,2,paywall teaser text currently paywall teaser text show title but line text fade a backend change need reveal small text blurb message etc
32,35440906,2,paywall autoplay video autoredirect blog user pay click twice play video redirect blog page
33,35405667,1,change wire language pay receive payment pay etc
34,35399928,1,group feed fit mobile web
35,35323386,2,add id tag use epic branch
36,35279841,1,rekey messenger close password change please read before open new issue sure search keyword issue filter t bug label verify issue submit duplicate summary when finish key password time close change window reset leave unsure work step reproduce use account mind lose message hit setting wheel messenger window hit key enter password hit change if work key platform information cross platform web what current bug behavior re key popout automatically close keying give indication work what expect correct behavior the key section visible successful change relevant log screenshot possible fix if link line code responsible problem
37,37972881,1,enable suggest hashtag widget inside composer the suggest hashtag widget show inside composer it work comment field this feature composer help user understand hashtag trend popular help typing
38,34986190,1,bring old indication schedule post summary the new indication schedule post unclear say indication schedule schedule we bring old yellow bar post contain useful information
39,34981646,2,scroll stall please read before open new issue sure search keyword issue filter t bug label verify issue submit duplicate summary summarize bug encounter concisely ca scroll past like blog step reproduce how reproduce issue important go filter blog scroll far platform information browser device system stat screen size chrome what current bug behavior what actually happen load circle what expect correct behavior what instead relevant log screenshot paste relevant log use code block format console output log code hard read y invoke anonymous notification single fail load resource delete api authenticate diagnostics id null environment stage group fail load resource server respond status fail load resource server respond status diagnostics id environment stage boost rotator recording impression true uncaught promise domexception the play request interrupt new load request error uncaught promise object entity d e y invoke anonymous devtools fail load sourcemap could load content chrome sourcemap http error status code devtools fail load sourcemap could load content chrome sourcemap http error status code possible fix if link line code responsible problem
40,34954348,1,color change analytic dashboard please read before open new issue sure search keyword issue filter t bug label verify issue submit duplicate summary the background color change analytic dashboard relevant log screenshot possible fix if link line code responsible problem
41,34906861,1,autosugg fire please read before open new issue sure search keyword issue filter t bug label verify issue submit duplicate summary in comment section type popup appear firefox step reproduce see platform information firefox chrome what current bug behavior no popup appear what expect correct behavior suggestion appear visible screen relevant log screenshot possible fix if link line code responsible problem
42,34897764,2,create pay modal click plus content follow similar structure dry membership tier use mockup usd tokens
43,34904247,2,composer text body appear rich embed please read before open new issue sure search keyword issue filter t bug label verify issue submit duplicate summary composer text body appear rich embed step reproduce take youtube video type composer try enter post platform information replicate firefox what current bug behavior ca post text area hide what expect correct behavior should text area rich embed relevant log screenshot possible fix if link line code responsible problem
44,53988719,1,safari upload issue please read before open new issue sure search keyword issue filter t bug label verify issue submit duplicate summary dreampondtx day minds upgrade upload vid imac safari click upload the file highlight file previously upload highlight mind allow select step reproduce presumably try upload safari platform information safari report macs multiple place unsure apply mobile os what current bug behavior user nt upload grey what expect correct behavior should able upload relevant log screenshot possible fix if link line code responsible problem
46,34717029,1,update pay boost button gray new icon please read before open new issue sure search keyword issue filter t bug label verify issue submit duplicate summary summarize bug encounter concisely step reproduce how reproduce issue important platform information browser device system stat screen size what current bug behavior what actually happen what expect correct behavior what instead relevant log screenshot paste relevant log use code block format console output log code hard read possible fix if link line code responsible problem
47,34693370,1,automatically select language base browser locale x use language browser x if cookie set use language instead default browser language x on signup use browser locale attribute
48,34688866,1,modal screen select language mockup
49,34688830,1,language footer component homepage marketing page mockup
50,34660853,1,channel view counter mismatch channel view impression counter feed sidebar match one about sidebar initially report
51,34627630,1,translation certain language break url summary when translate arabic example turn backwards question mark url work anymore also channel link break step reproduce go daryl davis post minds channel translate arabic try url inside translate text
52,34620926,1,refresh require upload new avatar please read before open new issue sure search keyword issue filter t bug label verify issue submit duplicate summary summarize bug encounter concisely step reproduce how reproduce issue important platform information browser device system stat screen size chrome what current bug behavior what actually happen what expect correct behavior what instead relevant log screenshot paste relevant log use code block format console output log code hard read possible fix if link line code responsible problem
53,120440576,2,add boost option post goal enable boosting opportunity increase boost enable minds team promote good content what need currently option boost post appear post for change want add option boost post qa consideration give issue demo test prior deploy ux design see acceptance criterion personas minds staff experiment n acceptance criteria the option boost post appear activity post one the option appear dropdown menu post definition ready checklist definition of done dod acceptance criterion weighted qa ux design personas experiment
54,34583278,1,translation special character bug french apostrophe show mixture gibberish hashtag
55,34576657,1,fix height boost issue click see more should open single view post page summary when click fix boost height rotator entire post step reproduce see video platform information web what current bug behavior see video what expect correct behavior when user click fix height nature boost rotator disable height adject accordingly relevant log screenshot possible fix little overlap
56,34572877,1,unable remind mobile web
57,34565631,1,mouseover remind post button turn hand please read before open new issue sure search keyword issue filter t bug label verify issue submit duplicate summary summarize bug encounter concisely step reproduce how reproduce issue important remind hover post arrow platform information browser device system stat screen size what current bug behavior what actually happen what expect correct behavior what instead relevant log screenshot paste relevant log use code block format console output log code hard read possible fix if link line code responsible problem
58,34527779,1,live comment bug please read before open new issue sure search keyword issue filter t bug label verify issue submit duplicate summary summarize bug encounter concisely jack post comment post appear fine comment show dozen time when i refresh normal step reproduce how reproduce issue important platform information browser device system stat screen size what current bug behavior what actually happen what expect correct behavior what instead relevant log screenshot paste relevant log use code block format console output log code hard read possible fix if link line code responsible problem
59,34527582,1,comment counter show filter discovery video blog please read before open new issue sure search keyword issue filter t bug label verify issue submit duplicate summary in canary discovery filter hashtag feed video blog like comment lot case step reproduce discovery search coronavirus filter videos notice comment counter tap comment icon twice popular post case comment exist platform information browser device system stat screen size what current bug behavior what actually happen what expect correct behavior what instead relevant log screenshot example post comment show possible fix if link line code responsible problem
60,34526472,1,browser button work please read before open new issue sure search keyword issue filter t bug label verify issue submit duplicate summary summarize bug encounter concisely step reproduce how reproduce issue important go setting press browser button platform information browser device system stat screen size chrome what current bug behavior what actually happen ca what expect correct behavior what instead go relevant log screenshot paste relevant log use code block format console output log code hard read possible fix if link line code responsible problem
61,34526184,1,reflect mobile discovery tab web boost feed split tag trend new page fix test
62,34521029,1,referral tooltip position the tooltip right place
63,34514967,1,username field signup field indicate incorrect please read before open new issue sure search keyword issue filter t bug label verify issue submit duplicate summary step reproduce how reproduce issue important space username platform information browser device system stat screen size what current bug behavior what actually happen what expect correct behavior what instead indicate problem like pw relevant log screenshot paste relevant log use code block format console output log code hard read possible fix if link line code responsible problem
64,34503098,2,allow content tag minds plus create use tag support tier allow support tier expire mockup
65,34502861,2,create plus membership tier minds plus mind plus channel support membership tier paywall hook minds plus module check content allocate plus user plus subcription
66,34502725,1,paywall exclusive content minds plus pay x backend exist paywall extend preview x new lockscreen component x display tiername right preview x remove paywall preview section settings b c people wo able customize anymore x display differently different medium type x fix showsubmittedinfo display regardless payment x investigate work vid blog x apply min height m status post x feature flaggable x paywall badge nsfw wall x handle vertical centering paywall message post text x consider read more x use old blog page medium page medium modal x observable x blurry galaxy thumb gif mockup endpoint api wire paywall fs thumbnail provide blur exclusive paywall info entity paywall should true false depend entity activity object set it null entity paywalle javascript object follow property type string money usd token minds tokens min number the minimum type view user wire day owner order object content string urn support tier entity need unlock urn support in future populate original structure support single currency
67,34502581,2,plus backend frontend api service backend api frontend service endpoint api plus feed feed response json status success hero feed
68,34502497,1,create plus page basic page router module tab feature flag mockup provide
69,34494249,1,popover notification inside grid new ui please read before open new issue sure search keyword issue filter t bug label verify issue submit duplicate summary the popover notification right align new ui step reproduce trigger notification platform information all platform relevant log screenshot possible fix if align grid
70,34468952,1,divider line flash black loading
71,34460161,1,youtube migrator bug transfer video button break auto import checkbox break queue transfer header update need live complete transfer fix thumbnail issue need sort prompt let user know automatically day walk away x invalid date transferred tab fix newsfeed post reflect youtube upload date implement alternative authentication option add link youtube description
72,34420243,1,animation discovery result probably lack engagement need pull
73,34411278,1,pro icon miss new channel show badge component
75,34318834,1,pin option appear post canary please read before open new issue sure search keyword issue filter t bug label verify issue submit duplicate summary options pin unpin appear new activity step reproduce click post menu platform information all what current bug behavior option pin unpin appear new activity what expect correct behavior it appear owner post channel group owner moderator post group what instead relevant log screenshot paste relevant log use code block format console output log code hard read possible fix if link line code responsible problem
76,34278808,1,click comment icon view x comment if i click link view comment i show comment if i click comment icon instead i show comment instead view comment link disappear the behave interchangeably
77,34278141,1,various activity icon issue x all color x when toggle e visual indication select it slightly dark color select x these icon move bit fit box x the attachment icon image paperclip x the close ribbon caret icon feel claustrophobic revert fix
78,34278087,1,hide boost rotator result backend step replicate create new account switch canary mode go newsfeed screenshot i imagine new user sign flip switch canary need fix there blank space also sidebar boost show these hide new user logic newsfeed boost
79,34277750,1,signup login modal checkbox align canary superstructure place misalign
80,34239371,1,notification infinite scroll glitch the load partially obscure extend available scroll distance
81,34235343,2,video issue scroll new channel plus pro user autoplay make feed jump rapidly scroll feed video
82,34226682,1,remind thumbnail blank youtube import vid
84,34126199,1,direct user set wallet set sendwyre please read before open new issue sure search keyword issue filter t bug label verify issue submit duplicate summary if user wallet redirect address step reproduce log wallet try log go hit buy eth hit buy observe eth address platform information cross platform web what current bug behavior allow user purchase wallet what expect correct behavior should direct user wallet account relevant log screenshot paste relevant log use code block format console output log code hard read possible fix if link line code responsible problem
85,34123470,2,popover notif see canary
86,34122642,1,delete post show post canary canary mode show delete post option user post oppose click bring be sure want delete post click yes actually delete post thankfully
87,34120893,1,unmute button work video turn volume unmute chrome
88,34099229,1,implement canonical seo tag discovery trend page eg x canonical link original post
89,34085003,1,add word pay activity post change lightning icon
90,34047151,1,fix auto import youtube checkbox transfer display auto import work setup modal x transfer grey click
91,34043425,1,sidebar spinner alignment this spinner horizontally center rest icon
92,34037452,8,remain youtube issue little tweak remain youtube importer x remove dummy count datum x enable transfer status count x spinner loading video list instead notice x setup modal work x remove load datum response result length limit x fix broken delete endpoint x account disconnect work
93,34036910,1,toast notification disappear quickly long content i get error notification fade duration short read text but duration fine text possible solution allow disappearance hover notification optional input param duration toast toast basis extend notification time content certain qty character
94,34036288,1,wallet cash remove bank account link functional summary look like remove bank account wallet cash step reproduce add bank account wallet cash try remove what current bug behavior you error notice what expect correct behavior you able remove bank account remove link visible bank account for multiple bank account like way reset param want remove default bank account relevant log screenshot possible fix if link line code responsible problem bug triage new
95,34033185,1,modal overlay connect youtube modal please read before open new issue sure search keyword issue filter t bug label verify issue submit duplicate summary summarize bug encounter concisely step reproduce how reproduce issue important platform information chrome what current bug behavior dark overlay look like modal what expect correct behavior a modal relevant log screenshot possible fix shrug
96,34026875,1,apply language field elastic search mapping detect language post default en detect language
97,34026810,1,ability select language setting mockup require reusable language picker component setting page select language test select language
98,34026791,1,improve design locationisation page need update suit new design we need list support language mockup
99,34017249,1,wallet tab alignment rest wallet the tab overview transaction setting narrow padding margin rest wallet component
100,30071164,4,create activity component
101,30050559,5,add post scheduler new composer scheduler drop user click arrow small scheduler light mode x drop schedule post open scheduler control x implement date picker time picker user local time x implement small version x light mode x dark mode later later x responsive design x point mr epic branch
103,30050069,6,add video image uploader new composer the upload button new composer allow uploading image video like exist paper clip upload landscape portrait small mode light mode x constrain height image composer modal resize outer box do shrink text x upload image exist image endpoint x prepare video endpoint upload video sign url return server select nsfw scope activity save stage x preview composer text entry title x allow deletion removal image video x button x button available edit mode exist this tackle edit dedicate card x x button delete attachement server x upload image enable add title button x light mode x dark mode x unit test write end epic x responsive design x point mr epic branch
