,issuekey,storypoints,context
592,18847497,1,bug conversation upload bar overflowing chrome pretty clear green bar extend far png
593,18843162,2,feat add toggle search be bug make sure use bug template detailed report possible
594,18841164,2,test further fix test new chromeheadlessci be bug make sure use bug template detailed report possible
595,18810666,2,feat create blog use current poster content be bug make sure use bug template detailed report possible
596,18790588,7,feat mobile view navbar similar mobile app be bug make sure use bug template detailed report possible
597,18783042,2,chore clicking hashtag prefer switch discovery be bug make sure use bug template detailed report possible
598,18783031,2,feat add boostfeed link newsfeed screen similar sort selector discovery be bug make sure use bug template detailed report possible
599,18783011,5,feat mobile view sidebar hashtag selector be bug make sure use bug template detailed report possible
600,21509521,4,bug mobile wallet screen horizontal scrolling general ui problem please read before open new issue sure search keyword issue filter t bug label verify issue submit duplicate summary wallet screen scroll horizontally lot element cut thing need bit rework step reproduce scroll sideways platform information edge android what current bug behavior you scroll sideways slightly what expect correct behavior the x axis relevant log screenshot possible fix if link line code responsible problem
601,21509359,2,bug mobile boost button cut please read before open new issue sure search keyword issue filter t bug label verify issue submit duplicate summary boost button cut mobile web noticed boost blog step reproduce this probably occur phone wide aspect ratio head blog post boost platform information edge android what current bug behavior what actually happen what expect correct behavior what instead relevant log screenshot possible fix if link line code responsible problem be bug make sure use bug template detailed report possible
602,21509328,1,bug mobile new blog buttons screen
603,21479533,5,bug banning stop user post public group chat please read before open new issue sure search keyword issue filter t bug label verify issue submit duplicate summary banning group prevent user post step reproduce this test help support have test user account post have account ban group see test user post refresh test user post platform information demonstrate chromium manjaro presumably low level universal what current bug behavior user post ban on refresh show group member post what expect correct behavior user able post join group relevant log screenshot paste relevant log use code block format console output log code hard read possible fix if link line code responsible problem
604,21477808,2,hotfix non canary es feed personal group feed crash site be bug make sure use bug template detailed report possible
605,21455255,1,feat inject platform client media be bug make sure use bug template detailed report possible
606,21406939,5,bug poor scrolling performance mobile web bar be bug make sure use bug template detailed report possible
607,21406733,3,test fix spec test component affect clientmeta be bug make sure use bug template detailed report possible
608,21406654,2,feat inject client meta boost rotator beacon single activity component be bug make sure use bug template detailed report possible
609,21389460,3,chore inject position slot be bug make sure use bug template detailed report possible
610,21389449,1,chore send generic medium activity feature content boost rotator be bug make sure use bug template detailed report possible
611,21389445,2,feat setup unique hash id different section pass di chain be bug make sure use bug template detailed report possible
612,21389439,3,chore setup angular di chain service inherit client meta piece implement subscribed discovery channel group feed be bug make sure use bug template detailed report possible
613,21378097,2,send client meta activity view beacon be bug make sure use bug template detailed report possible
614,21222433,2,feat new hamburger dropdown item the limited link term service minds teespre store android mobile application link display portion left hand sidebar newsfeed page reduce end user accessibility easily miss user also i consider limit access minds teespre store restrict promotion associate minds merchandise reduce ability minds extra revenue stream
615,21221032,5,fix tweak analytic design be bug make sure use bug template detailed report possible
616,21191263,5,feat change filter bar mockup
617,21188019,1,fix change block user content remind notice block user belong be bug make sure use bug template detailed report possible
618,21182576,1,chore bulb icon log state homepage be bug make sure use bug template detailed report possible
620,21113896,1,fix disabled scrollbar show summon modal windows be bug make sure use bug template detailed report possible
621,21101936,2,bug ios mobile web view cut registration button please read before open new issue sure search keyword issue filter t bug label verify issue submit duplicate summary the registration button cut mobile web step reproduce visit try scroll right platform information test iphone seem apparent safari chrome button cut what current bug behavior the window autoscroll click register button what expect correct behavior button bound scroll area relevant log screenshot possible fix if link line code responsible problem bug triage new
622,21005344,2,feat strike page reference specific content cause strike provide link reference post cause violation
623,20943689,1,bug login redirect newsfeed mobile web please read before open new issue sure search keyword issue filter t bug label verify issue submit duplicate summary logging mobile web popup modal redirect user newsfeed content view step reproduce either mobile horizontally shrink browser window desktop mobile size visit site scroll await login popup login platform information multi platform mobile web what current bug behavior user redirect news feed what expect correct behavior the user return content view relevant log screenshot paste relevant log use code block format console output log code hard read possible fix if link line code responsible problem bug triage new
624,20910749,3,send beacon feed engagment discovery be bug make sure use bug template detailed report possible
625,20899077,2,feat remember preferred hashtag status it nice set cookie user choice remember
626,20898199,2,fix top channel show block user be bug make sure use bug template detailed report possible
627,20894031,1,bug video bulb control show black dark mode please read before open new issue sure search keyword issue filter t bug label verify issue submit duplicate summary as see image dark mode bulb control show black white step reproduce look video dark mode platform information cross platform desktop app version live site what current bug behaviour control show black what expect correct behaviour control colour match button white relevant log screenshot possible fix i assume miss dark mode colour scheme
628,20853018,7,feat test blog be bug make sure use bug template detailed report possible
629,20882560,2,bug widen mouse click event area scroll group see video
630,20846404,2,send beacon feed engagment subscribe be bug make sure use bug template detailed report possible
631,20765114,1,fix tooltip misalign group sidebar mobile resolution be bug make sure use bug template detailed report possible
632,20739925,1,send client meta sidebar boost vote be bug make sure use bug template detailed report possible
633,20739911,2,send client meta sidebar boost subscription be bug make sure use bug template detailed report possible
634,20739876,3,inject client meta sidebar boost be bug make sure use bug template detailed report possible
635,20739853,3,send client meta boost view beacon be bug make sure use bug template detailed report possible
636,20739837,3,send client meta comment be bug make sure use bug template detailed report possible
637,20703645,7,send client meta vote remind be bug make sure use bug template detailed report possible
638,20701842,2,fix refactor use observable vs promise changedetection outside scope be bug make sure use bug template detailed report possible
640,21795681,2,bug mobile web group chat close click box chat summary every time click box type chat chat close if scroll box chat close if try paste box chat close step reproduce use mobile click group chat click box type buggy scroll browser os google chrome mobile report what current bug behavior user type chat return view group feed what expect correct behavior user able interact chat relevant log screenshot paste relevant log use code block format console output log code hard read possible fix if link line code responsible problem
642,20571337,1,feat update canary page be bug make sure use bug template detailed report possible
643,20562833,2,feat handle block user comment thread display note apparent thread be bug make sure use bug template detailed report possible
644,20537595,6,fix boost visibility issue be bug make sure use bug template detailed report possible
646,20516269,5,test fix spec test es feeds be bug make sure use bug template detailed report possible
647,20516003,1,fix dark mode sort selector block remind notice be bug make sure use bug template detailed report possible
648,20515657,5,fix debounce account viewport accounting activity view create local service be bug make sure use bug template detailed report possible
650,20489333,1,fix boost activity show channel group discovery be bug make sure use bug template detailed report possible
651,20445596,2,bug suggest hashtag bug the default close when i tap trend default disappear
652,20442553,3,feat add test case spreadsheet be bug make sure use bug template detailed report possible
653,20419425,2,fix issue scrollservice be bug make sure use bug template detailed report possible
654,20406918,2,ability upload audio file wav ogg etc option leverage plyr medium player handle audio file like example use party audio player waveform display transcode large lossless format arweave host high quality lossless audio upload
655,20394046,3,feat implement blocklist reminds be bug make sure use bug template detailed report possible
656,20394033,2,feat implement blocklist comment view be bug make sure use bug template detailed report possible
657,20393990,2,feat inject boost new subscribed feed be bug make sure use bug template detailed report possible
658,20374676,2,fix conversation toggle group hide mobile web be bug make sure use bug template detailed report possible
659,20374419,2,fix notification popup group bar mobile web be bug make sure use bug template detailed report possible
660,20355858,8,feat implement lazy sync timebase feed be bug make sure use bug template detailed report possible
661,20346877,3,bug if translation fail report error message ui please read before open new issue sure search keyword issue filter t bug label verify issue submit duplicate summary as point it appear user able translate certain post step reproduce visit follow link hit translate platform information browser device system stat screen size what current bug behavior text translate choose language what expect correct behavior text translatable relevant log screenshot possible fix as i replicate post simple post espaol spanish the translate work fine also repeat deutsch german get result so i presume common factor link example post one clover character mess thing appear special character plenty non english pretty standard character long i wonder error throw report bug triage new
662,20315625,2,fix moredata set false entity subset unreadable be bug make sure use bug template detailed report possible
663,20315420,3,chore create review feed component fork sorted feed be bug make sure use bug template detailed report possible
664,20315217,2,chore move group kick ban modal logic component be bug make sure use bug template detailed report possible
665,20314846,5,feat implement boostsync boost rotator be bug make sure use bug template detailed report possible
666,20301681,3,feat prevent blog edit change page warn be bug make sure use bug template detailed report possible
667,20300996,2,fix solve be bug make sure use bug template detailed report possible
668,20299539,1,chore resolve be bug make sure use bug template detailed report possible
669,20299476,1,chore add readme be bug make sure use bug template detailed report possible
670,20299452,3,chore resolve be bug make sure use bug template detailed report possible
671,20289323,4,chore add miss group functionality pende review user kick ban be bug make sure use bug template detailed report possible
672,20289313,1,feat add nsfw selector subscribed feed be bug make sure use bug template detailed report possible
673,20280216,3,bug block user show subscribe window please read before open new issue sure search keyword issue filter t bug label verify issue submit duplicate summary report i remove users subscribers list multiple time remain list refresh page blocks can delete sub list those i block remain subscribed to me not my subscription subscriber i block their channel icon list count decrease in word icon relevant link step reproduce follow main account test block main account observe main account follow platform information browser device system stat screen size what current bug behavior unsubscribed user user subscribe section what expect correct behavior user correctly appear anymore relevant log screenshot paste relevant log use code block format console output log code hard read possible fix if link line code responsible problem bug triage new
674,20272112,3,proto group feed be bug make sure use bug template detailed report possible
675,20271691,3,feat subscribe feed list new endpoint be bug make sure use bug template detailed report possible
676,20242000,3,feat test post attachment be bug make sure use bug template detailed report possible
677,20240124,2,feat update be bug make sure use bug template detailed report possible
678,20228422,1,chore remove counter faux activity post discovery channel view view counter feed inconsistent display number view specific feed total number view step reproduce go hour video feed observe view count post next channel page content creator notice view count original post synche feed platform information chrome what current bug behavior inconsistent view counter content view counter synch real time near real time counter consistent feed feed relevant log screenshot possible fix if link line code responsible problem
680,20176362,5,bug canary dark theme post description messenger please read before open new issue sure search keyword issue filter t bug label verify issue submit duplicate summary text dark post description canary right image step reproduce enable canary enable dark mode scroll newsfeed post like platform information manjaro chromium what current bug behavior the text dark realistically readable what expect correct behavior the text bit light strain eye relevant log screenshot possible fix the colour likely set css global value
681,20175843,2,feat update gitlab report page i go update text report bug alert user need response ask question report a bug correct place while i i need add tooltip maybe placeholder debug change work auto labelling locally server
682,20142424,2,bug comment bubble blog get cut please read before open new issue sure search keyword issue filter t bug label verify issue submit duplicate summary ui bug improvement need comment box get cut web app blog step reproduce go blog article go comment comment box cut user type platform information android brave browser relevant log screenshot
684,20122662,5,create ui report hash tag find appropriate spot ui user report hashtag call new end update report hash tag
685,20120072,5,feat add nsfw mature blur sensitive content module medium grid be bug make sure use bug template detailed report possible
686,20120032,1,chore polish user medium view grid add white background rounder border padding container consider column wide vs
687,20119940,3,feat display unlisted label unlisted medium be bug make sure use bug template detailed report possible
688,20119919,5,feat channel sidebar module container be bug make sure use bug template detailed report possible
689,20117009,2,bug the inbox outbox button cut boost console safari ios please read before open new issue sure search keyword issue filter t bug label verify issue submit duplicate summary note the account i test satyapriya note canary mode turn step reproduce go click offer platform information iphone se ios safari what current bug behavior the inbox outbox button cut boost console safari ios what expect correct behavior the inbox outbox button cut boost console safari ios relevant log screenshot possible fix if link line code responsible problem
690,20113965,1,nsfw reason cut boost summary while boost queue nsfw reason get cut post step reproduce scroll boost queue short text post then moderate nsfw platform information windows brave what current bug behavior list nsfw reason get hide boost post what expect correct behavior nsfw reason overlay select relevant log screenshot nsfw png possible fix
691,20086738,2,bug click notif take user page please read before open new issue sure search keyword issue filter t bug label verify issue submit duplicate summary click notification button take user page erase comment work step reproduce scroll discovery click notification icon relevant log screenshot
692,20081276,2,feat mobile beta canary user be bug make sure use bug template detailed report possible
693,20039644,2,bug channel listing skew ubuntu chrome
694,20039617,2,bug video play ubuntu chrome
695,20034904,3,bug group group bar default default wrong feed switch mid scroll please read before open new issue sure search keyword issue filter t bug label verify issue submit duplicate summary groups resolve chat instead post default groups bar mobile browser ios iphone xr new build it inconsistent this group load feed automatically continuously load chat make rhyme reason i find iphone i hold pull feed load this browser app btw step reproduce create group call group chat default set default view chat create counterpart feed chat default set default chat feed click group observe scroll platform information report iphone xs ios safari test edge android brave what current bug behavior it hard tell issue mask thing bit default set feed show chat scroll what expect correct behavior the default view load relevant log screenshot paste relevant log use code block format console output log code hard read possible fix if link line code responsible problem bug triage new
696,20043135,5,feat splitting badge area separate section profile as describe this need complete add badge chain i care
697,20014032,5,bug navigate group conversation miss mobile web there currently way group conversation mobile web it occasionally load initially click group avatar revert group feed way conversation we need add button toggle feed conversation group page mobile web initial click group avatar group feed
698,20014006,2,bug black dot appear group avatar mobile web please read before open new issue sure search keyword issue filter t bug label verify issue submit duplicate summary there small black dot appear group avatar mobile web step reproduce mobile web view group platform information io chrome safari iphone android what expect correct behavior no black dot relevant log screenshot
699,20013986,3,bug tooltip mobile web group please read before open new issue sure search keyword issue filter t bug label verify issue submit duplicate summary tooltips block group avatar group scroll bar ios mobile web step reproduce open app mobile web ios platform information ios chrome safari iphone what current bug behavior tooltip activate block group avatar navigate what expect correct behavior tool tip appear avatar relevant log screenshot possible fix
700,23438195,2,fix admin nsfw lock override user select nsfw tag be bug make sure use bug template detailed report possible
701,23437547,1,send wire user be bug make sure use bug template detailed report possible
702,23437304,2,comment notification scroll correct place be bug make sure use bug template detailed report possible
703,23435876,2,onboarding flow be bug make sure use bug template detailed report possible
704,23435843,2,register user be bug make sure use bug template detailed report possible
705,23435713,2,create remind delete remind be bug make sure use bug template detailed report possible
706,23435642,2,subscribing unsubscribing be bug make sure use bug template detailed report possible
707,23435572,2,comment thread be bug make sure use bug template detailed report possible
708,23435552,1,boost impression record boost rotator feed be bug make sure use bug template detailed report possible
709,23435500,1,revoke boost be bug make sure use bug template detailed report possible
710,23435468,2,create boost be bug make sure use bug template detailed report possible
711,23414600,2,fix rollback commit nsfw selector hashtag selector be bug make sure use bug template detailed report possible
712,23414583,1,fix update base feedback be bug make sure use bug template detailed report possible
713,23410674,8,feat see more open modal infinite scrolling be bug make sure use bug template detailed report possible
714,23410561,5,feat style footer be bug make sure use bug template detailed report possible
715,23409308,3,feat use footer setting tweak style be bug make sure use bug template detailed report possible
716,23394386,3,feat footer item setting be bug make sure use bug template detailed report possible
717,23360542,5,feat create footer be bug make sure use bug template detailed report possible
719,23352257,1,fix use excerpt tile subtext entity blog be bug make sure use bug template detailed report possible
722,23328017,5,feat learn token implement wire frame current design language
723,23328010,5,feat new wallet main page this create structure main page the graph onchain ui different card
724,23327991,5,feat setup onchain wallet new ui implement new onchain wallet setup flow
725,23327979,5,feat new wallet transaction tab implement new wallet transaction
726,23327958,5,feat wallet landing page implement wire frame user wallet setup exist design language
727,23513278,1,feature extend limit group item support infinite like user feed here feedback squad leader current situation emi there post hard limit feed right emi we workaround user feed emi people like scroll channel mark harding channel infinite newsfeed able copy logic easily emi ah i think complain feed group let verify post user channel apply change end
729,23326608,3,feat user channel feed there x schedule activity banner be bug make sure use bug template detailed report possible
731,23326565,3,feat add scheduler feed activity edit mode be bug make sure use bug template detailed report possible
733,23326193,5,chore create pre commit gitlab step prevent check fit fdescribe it far easy check fit fdescribe end unit test probably little script regex sufficient bomb find one
734,23324744,2,chore check client date validation logic creation start past end month start update if pende create start past end month start if run start change end month start
735,23324728,2,feat implement lifecycle notification template depend
736,23316900,1,feat list item be bug make sure use bug template detailed report possible
737,23316840,1,feat signup headline come backend be bug make sure use bug template detailed report possible
739,23278403,1,fix comment load medium gallery miss injector medium gallery
741,23235302,5,bug boost console recent post load batch content sidebar boost please read before open new issue sure search keyword issue filter t bug label verify issue submit we need fix boost console load available entity like current channel page boost console need use elastic search feed service create new boost wo hook like boost feed boost rotator should able opy channel feed summary user zoraya report way sidebar boost old content page load step reproduce log visit observe scroll content platform information cross platform web what current bug behavior only select bit content show what expect correct behavior this feed user content relevant log screenshot possible fix if link line code responsible problem
742,23235240,5,bug can paste status mobile web please read before open new issue sure search keyword issue filter t bug label verify issue submit duplicate summary can paste post box mobile web step reproduce log long press newsfeed poster observe menu pop platform information reproduce edge brave browser what current bug behavior paste selection menu open what expect correct behavior menu open relevant log screenshot paste relevant log use code block format console output log code hard read possible fix if link line code responsible problem bug triage new
743,23206151,1,feat add transparent overlay color be bug make sure use bug template detailed report possible
745,23199436,2,fix boost campaign show sidebar be bug make sure use bug template detailed report possible
746,23195837,2,feat prompt feed be bug make sure use bug template detailed report possible
747,23173300,4,feat hot top late selector content image video blog feed be bug make sure use bug template detailed report possible
749,23173205,3,feat tile group be bug make sure use bug template detailed report possible
750,23173098,3,feat style search box enter key search be bug make sure use bug template detailed report possible
751,23173045,1,feat top bar logo nav pro root be bug make sure use bug template detailed report possible
752,23172915,8,feat search page be bug make sure use bug template detailed report possible
